{
  "schema_version": "football-web-research-v1.1",
  "diagnostic_only": true,
  "ready_for_analysis": false,
  "ready_for_quant": false,
  "statistics_usable_in_production": false,
  "execution_mode": "real_only_cache",
  "status": "source_blocked",
  "requested_event": [
    "36411",
    "2282",
    "2026-10-12"
  ],
  "verified_at": "2026-10-11T22:00:00+00:00",
  "identity": {
    "canonical_mapping_reference_verified": true,
    "current_event_verified": false,
    "basis": "prior_saved_identity_review_not_new_live_validation",
    "reference": "history-v2:levante-sevilla",
    "reference_commit": "68a704878a42c58920ce9294798406a1eacddbcb",
    "competition": "PD",
    "kickoff_utc": "2026-10-12T19:00:00+00:00",
    "teams": {
      "away": {
        "canonical_id": "local:team:sevilla",
        "display_name": "Siviglia",
        "provider_ids": {
          "api_football": 536,
          "football_data": 559
        }
      },
      "home": {
        "canonical_id": "local:team:levante",
        "display_name": "Levante",
        "provider_ids": {
          "api_football": 539,
          "football_data": 88
        }
      }
    },
    "api_football_fixture_id": 1570407,
    "football_data_match_id": 564704
  },
  "teams": {
    "away": {
      "canonical_id": "local:team:sevilla",
      "provider_ids": {
        "api_football": 536,
        "football_data": 559
      },
      "categories": {
        "recent_results": {
          "status": "source_blocked",
          "claims": [],
          "search_scope": "saved_cache_only",
          "absence_is_not_proof_of_no_injury_or_suspension": true
        },
        "standings": {
          "status": "source_blocked",
          "claims": [],
          "search_scope": "saved_cache_only",
          "absence_is_not_proof_of_no_injury_or_suspension": true
        },
        "injury": {
          "status": "source_blocked",
          "claims": [],
          "search_scope": "saved_cache_only",
          "absence_is_not_proof_of_no_injury_or_suspension": true
        },
        "suspension": {
          "status": "source_blocked",
          "claims": [],
          "search_scope": "saved_cache_only",
          "absence_is_not_proof_of_no_injury_or_suspension": true
        },
        "availability": {
          "status": "source_blocked",
          "claims": [],
          "search_scope": "saved_cache_only",
          "absence_is_not_proof_of_no_injury_or_suspension": true
        },
        "probable_lineup": {
          "status": "source_blocked",
          "claims": [],
          "search_scope": "saved_cache_only",
          "absence_is_not_proof_of_no_injury_or_suspension": true
        },
        "official_lineup": {
          "status": "source_blocked",
          "claims": [],
          "search_scope": "saved_cache_only",
          "absence_is_not_proof_of_no_injury_or_suspension": true
        },
        "schedule": {
          "status": "source_blocked",
          "claims": [],
          "search_scope": "saved_cache_only",
          "absence_is_not_proof_of_no_injury_or_suspension": true
        },
        "news": {
          "status": "source_blocked",
          "claims": [],
          "search_scope": "saved_cache_only",
          "absence_is_not_proof_of_no_injury_or_suspension": true
        }
      },
      "source_access_observations": [
        {
          "url": "https://www.laliga.com/robots.txt",
          "collected_at": "2026-10-11T21:48:51.783040+00:00",
          "origin": "real_access_attempt",
          "status": "source_blocked",
          "reason": "proxy_tunnel_denied_403",
          "http_status": null,
          "proxy_tunnel_status": 403,
          "content_retrieved": false
        },
        {
          "url": "https://sevillafc.es/robots.txt",
          "collected_at": "2026-10-11T21:48:51.800655+00:00",
          "origin": "real_access_attempt",
          "status": "source_blocked",
          "reason": "proxy_tunnel_denied_403",
          "http_status": null,
          "proxy_tunnel_status": 403,
          "content_retrieved": false
        }
      ]
    },
    "home": {
      "canonical_id": "local:team:levante",
      "provider_ids": {
        "api_football": 539,
        "football_data": 88
      },
      "categories": {
        "recent_results": {
          "status": "source_blocked",
          "claims": [],
          "search_scope": "saved_cache_only",
          "absence_is_not_proof_of_no_injury_or_suspension": true
        },
        "standings": {
          "status": "source_blocked",
          "claims": [],
          "search_scope": "saved_cache_only",
          "absence_is_not_proof_of_no_injury_or_suspension": true
        },
        "injury": {
          "status": "source_blocked",
          "claims": [],
          "search_scope": "saved_cache_only",
          "absence_is_not_proof_of_no_injury_or_suspension": true
        },
        "suspension": {
          "status": "source_blocked",
          "claims": [],
          "search_scope": "saved_cache_only",
          "absence_is_not_proof_of_no_injury_or_suspension": true
        },
        "availability": {
          "status": "source_blocked",
          "claims": [],
          "search_scope": "saved_cache_only",
          "absence_is_not_proof_of_no_injury_or_suspension": true
        },
        "probable_lineup": {
          "status": "source_blocked",
          "claims": [],
          "search_scope": "saved_cache_only",
          "absence_is_not_proof_of_no_injury_or_suspension": true
        },
        "official_lineup": {
          "status": "source_blocked",
          "claims": [],
          "search_scope": "saved_cache_only",
          "absence_is_not_proof_of_no_injury_or_suspension": true
        },
        "schedule": {
          "status": "source_blocked",
          "claims": [],
          "search_scope": "saved_cache_only",
          "absence_is_not_proof_of_no_injury_or_suspension": true
        },
        "news": {
          "status": "source_blocked",
          "claims": [],
          "search_scope": "saved_cache_only",
          "absence_is_not_proof_of_no_injury_or_suspension": true
        }
      },
      "source_access_observations": [
        {
          "url": "https://www.laliga.com/robots.txt",
          "collected_at": "2026-10-11T21:48:51.783040+00:00",
          "origin": "real_access_attempt",
          "status": "source_blocked",
          "reason": "proxy_tunnel_denied_403",
          "http_status": null,
          "proxy_tunnel_status": 403,
          "content_retrieved": false
        },
        {
          "url": "https://www.levanteud.com/robots.txt",
          "collected_at": "2026-10-11T21:48:51.797538+00:00",
          "origin": "real_access_attempt",
          "status": "source_blocked",
          "reason": "proxy_tunnel_denied_403",
          "http_status": null,
          "proxy_tunnel_status": 403,
          "content_retrieved": false
        }
      ]
    }
  },
  "blockers": [],
  "provenance": {
    "new_web_requests": 0,
    "cache_revision": "39e909166916198e12c217b12882da4d6f06c31c631a8356b2d8898cc97c1b0f",
    "real_web_claims_verified": 0,
    "untrusted_content_is_data": true,
    "current_event_revalidated": false,
    "upstream_statistics_imported": false
  }
}
